type,title,startDate,endDate,timestamp,location,url,eventType,videocast,description,keywords,Notes
NIAID BioVisualization,RSNA 2023 Test,11/26/23,11/29/23,1700956851,Chicago IL,https://bioinformatics.niaid.nih.gov/rsna-2023,Exhibit,no,"The NIAID Bioinformatics and Computational Biology  team will be presenting as part of the technical exhibits at the Radiological Society of North America (RSNA) Annual Meeting  from Nov 26-29th, 2023 in Chicago, Illinois. Please come visit us to learn more about the applications and services that our team provides at NIAID.",RSNA,
Scientific programming,Intro to R: Data wrangling ,7/8/24,7/8/24,1:00PM,Remote,,Training,yes,"Overview of R programming language, data manipulation, and data visualization",R,NIAID only
Scientific programming,Intro to R: Data visualization ,7/15/24,7/15/24,1:00PM,Remote,,Training,yes,"Overview of R programming language, data manipulation, and data visualization",R,NIAID only
Scientific programming,Intro to R: Data analysis,7/22/24,7/22/24,1:00PM,Remote,,Training,yes,"Overview of R programming language, data manipulation, and data visualization",R,NIAID only
Data Science,Real-world data analysis in R,7/29/24,7/29/24,1:00PM,Remote,,Training,yes,"Overview of real-world data and statistical analysis concepts, data analysis and visualization of a real-world dataset",R,NIAID only
Statistics,Statistical hypothesis testing in Prism,5/1/24,5/1/24,12:00PM,"Bethesda, MD",,Training,no,"Overview: This workshop will focus on how to choose an appropriate statistical test given data and hypothesis. It will include a hands on section for attendees to practice how to run these tests using Prism. Specific topic include the following: unpaired t-test, paired t-test, ordinary one-way ANOVA, repeated measures one-way ANOVA and non-parametric tests, Chi-square test and Fisher’s exact test.",Prism,NIAID only
,,,,,,,,,,,